{
  "$schema": "https://cha2a.org/schemas/conformance-profile-v1.json",
  "suite": "cha2a-conformance",
  "spec": {
    "id": "did:cha2a",
    "name": "did:cha2a DID Method",
    "version": "v0.3 (PR #2)",
    "ref": "https://github.com/wwumit/did-method-cha2a/blob/main/did-method-cha2a.md"
  },
  "fixtureManifest": "MANIFEST.sha256",
  "verifiers": [
    {
      "language": "python",
      "path": "verifiers/python",
      "coverage": "Ed25519 (cryptography) + ABNF + L0-L4 + CRUD + DID doc"
    },
    {
      "language": "node",
      "path": "verifiers/node",
      "coverage": "Ed25519 (node:crypto) + ABNF + L0-L4 + CRUD + DID doc（独立实现）"
    }
  ],
  "fixtureCount": 54,
  "negativeVectorRatio": ">1/3 (REJECT 向量占比，防 happy-path-only)",
  "liveEndpoints": [
    {
      "target": "legacy-production (compliancehub.cn:8787)",
      "result": "10/10 PASS",
      "mode": "readonly",
      "note": "规范参考实现（Node）达标"
    },
    {
      "target": "new-registry (火山 :5000)",
      "result": "5/8 PASS",
      "mode": "readonly",
      "gaps": [
        "/.well-known/cha2a 未实现（规范 §5.2 discovery）",
        "number-ranges 端点未实现（规范 §3.3 号段授权机制）",
        "evidence/query 字段名 did vs 规范/旧站 subject（不一致待核对）"
      ]
    }
  ],
  "notCovered": [
    {
      "specSection": "§4.6 L4 ecosystem state",
      "reason": "需 ≥2 独立真实 verifier + 可审计重验证——fixtures 无法证明"
    },
    {
      "specSection": "§4.2.1 Federation",
      "reason": "规范明确超范围"
    },
    {
      "specSection": "§4.7 Runtime attestation",
      "reason": "reserved，无运行行为"
    },
    {
      "specSection": "§3.3 号段真实运营",
      "reason": "无真实号段——live 只验证机制（grant 记录可核验），不声称运营"
    },
    {
      "specSection": "§4.6 disclosure consistency",
      "reason": "L4 额外条件，场景未模拟"
    }
  ]
}